DD Field,Source Field,Field Description,Resource
OwnershipType,OwnershipType,"Current type of ownership of the business being sold.  i.e. Corporation, LLC, Sole P, Partnership, etc.,",Property
ParcelNumber,ParcelNumber,A number used to uniquely identify a parcel or lot.  This number is typically issued by the county or county assessor.  The AP number format varies from county to county.  It is recommended that all Parcel Numbers be transmitted without dashes or hyphens.,Property
ParkingFeatures,"GarageType, GreenEnergyEfficient, Inclusions, ParkingFeatures",A list of features or description of the parking included in the sale/lease.,Property
ParkingTotal,ParkingTotal,The total number of parking spaces included in the sale.,Property
PastureArea,AcresPasture,Measurement or percentage of the property that has been allocated as pasture or grazing area.,Property
PatioAndPorchFeatures,"Balcony, ExteriorFeatures",A list of features or description of the patio or porch included in the sale/lease.,Property
PetsAllowed,PetsAllowed,"Are pets allowed at the property being leased?  A list of yes, no and more detailed restrictions/allowances.",Property
PhotosChangeTimestamp,PhotosChangeTimestamp,System generated timestamp of when the last update or change to the photos for this listing was made.,Property
PhotosCount,PhotosCount,The total number of pictures or photos included with the listing.,Property
PoolFeatures,PoolFeatures,A list of features or description of the pool included in the sale/lease.,Property
PostalCode,PostalCode,The postal code portion of a street or mailing address.,Property
PostalCodePlus4,PostalCodePlus4,The postal code +4 portion of a street or mailing address.,Property
PropertyAttachedYN,"AttachedYN, PropertyAttached","A flag indicating that the primary structure is attached to another structure that is not included in the sale.  i.e. one unit of a duplex. This flag may be T/F, Y/N or a list of attached or detached. As with all flags, the field may be null.  In some systems this information may be part of the Property Sub Type.",Property
PropertyCondition,"ApproximateAge, NewConstructionYN",A list describing the condition of the property and any structures included in the sale.,Property
PropertySubType,"BuildingType, PropertySubType","A list of types of residential and residential lease properties, i.e. SFR, Condo, etc. Or a list of Sub Types for Mobile, such as Expando, Manufactured, Modular, etc.",Property
PropertyType,PropertyType,"A list of types of properties such as Residential, Lease, Income, Land, Mobile, Commercial Sale, etc...",Property
PublicRemarks,PublicRemarks,"Text remarks that may be displayed to the public. In an MLS, it is the field where information is entered for the public. This information is intended to be visible on-line. This is typically information that describes the selling points of the building and/or land for sale. Local conditions and rules will determine what such content can contain. Generally, the following information is excluded: any information pertaining to entry to the property, the seller and/or tenant, listing member contact information. In other systems, these remarks will be determined by local business rules.",Property
RoadFrontageType,RoadAccess,"Pick list of types of Road frontage.  i.e. Freeway frontage, No Road Frontage, etc. The road frontage of the property is an important factor in determining value of the property and it’s appropriateness for intended use.",Property
RoadSurfaceType,RoadAccess,Pick list of types of surface of the Road to access the property.  The surface of the road(s) for access to the property is an important factor in determining value of the property and it’s appropriateness for intended use.,Property
Roof,Roof,"A list describing the type or style of roof.  For example Spanish Tile, Composite, Shake, etc.",Property
RoomKitchenLevel,"KitchenOnLevelBasementCount, KitchenOnLevelGroundCount, KitchenOnLevelLowerCount, KitchenOnLevelMainCount, KitchenOnLevelSecondCount, KitchenOnLevelThirdCount, KitchenOnLevelUpperCount","[type] This field is a repeating element for each type of room selected in the RoomType field. For every RoomType there are two possible implementations. For a flat implementation (RETS 1.x only), each RoomType used is expected to appear as the '[type]' in the related rooms field name. i.e. RoomKitchenLevel. A relational implementation of rooms must omit the type from the field name and use RoomType to create a vertical representation of the various rooms. i.e. RoomLevel with Kitchen in the relational table's RoomType field.",Property
RoomsTotal,"NumberOfRooms, RoomCount",The number of rooms in the dwelling.,Property
SeatingCapacity,SeatingCapacity,The seating capacity of the business being sold.,Property
SecurityFeatures,"ExteriorFeatures, Inclusions, SecurityFeatures",A list describing the security features included in the sale/lease.,Property
SeniorCommunityYN,RetirementCommunityYN,The community is a senior community.,Property
Sewer,Sewer,A list describing the sewer or septic features of the property.,Property
SpaFeatures,"ExteriorFeatures, Inclusions, InteriorFeatures",A list of features or description of the spa included in the sale/lease.,Property
SpaYN,"ExteriorFeatures, Inclusions, InteriorFeatures, PropertyType",The property has a spa.,Property
StandardStatus,StandardStatus,"The status of the listing as it reflects the state of the contract between the listing agent and seller or an agreement with a buyer (Active, Active Under Contract, Canceled, Closed, Expired, Pending, Withdrawn). This is a Single Select field.",Property
StateOrProvince,StateOrProvince,Text field containing the accepted postal abbreviation for the state or province.,Property
Stories,Stories,The number of floors in the property being sold.,Property
StoriesTotal,StoriesTotal,"The total number of floors in the building.  In the case of multi-dwelling structures, this is the entire structure and not the individual dwelling being sold.",Property
StreetDirSuffix,StreetDirSuffix,The direction indicator that follows a listed property's street address.,Property
StreetName,StreetName,The street name portion of a listed property's street address.,Property
StreetNumber,StreetNumber,"The street number portion of a listed property's street address.  In some areas the street number may contain non-numeric characters.  This field can also contain extensions and modifiers to the street number, such as '1/2' or '-B'.  This street number field should not include Prefixes, Direction or Suffixes.",Property
StreetSuffix,StreetSuffix,The suffix portion of a listed property's street address.,Property
StructureType,Type,The type of structure.,Property
TenantPays,TenantPays,A list of services or items that the tenant is responsible to pay.,Property
Topography,Topography,"The state of the surface of the land included with the property.  i.e. flat, rolling, etc.",Property
TrashExpense,TrashExpense,The annual expense that is not paid directly by the tenant and is included in the Operating Expense calculations.,Property
UnitNumber,UnitNumber,"Text field containing the number or portion of a larger building or complex. Unit Number should appear following the street suffix or, if it exists, the street suffix direction, in the street address. Examples are: 'APT G', '55', etc.",Property
UnparsedAddress,"City, StateOrProvince, StreetDirPrefix, StreetDirSuffix, StreetName, StreetNumber, StreetNumberNumeric, StreetSuffix, UnitNumber","The UnparsedAddress is a text representation of the address with the full civic location as a single entity. It may optionally include any of City, StateOrProvince, PostalCode and Country.",Property
Utilities,"InteriorFeatures, Services, Utilities",A list of the utilities for the property being sold/leased.,Property
VacancyAllowance,VacancyAllowance,An estimate of the amount of rent that may be foregone because of unoccupied units.,Property
View,"FeaturesAreaInfluences, View",A view as seen from the listed property.,Property
ViewYN,"FeaturesAreaInfluences, Topography, View",The property has a view.,Property
VirtualTourURLBranded,"VirtualTourURL2Branded, VirtualTourURLBranded",A text field that holds the URL for a branded virtual tour of the property.,Property
VirtualTourURLUnbranded,"VirtualTourURL2Unbranded, VirtualTourURLUnbranded",A text field that holds the URL for an unbranded virtual tour of the property.,Property
WaterBodyName,"WaterBodyName, WaterbodyNameText","The name, if known, of the body of water on which the property is located. (E.g., lake name, river name, ocean name, sea name, canal name).",Property
WaterSource,WaterSource,A list of the source(s) of water for the property,Property
WaterfrontFeatures,"ExteriorFeatures, FeaturesAreaInfluences, WaterBodyType, Waterfront, WaterfrontExposure, WaterfrontFeatures, WaterfrontType",Features of the waterfront on which the property is located.,Property
WaterfrontYN,WaterFrontYN,The property is on the waterfront.,Property
WindowFeatures,"Inclusions, InteriorFeatures",A list of features or description of the windows included in the sale/lease.,Property
YearBuilt,"MobileHomeYear, YearBuilt","The year that an occupancy permit is first granted for the house or other local measure of initial habitability of the build. The type definition permits an empty value with an attribute noting that it is an unknown date or that the building is new construction. While constraints have not been applied, convention at the time of adoption has this as a four (4) digit year value.",Property
YearBuiltDetails,YearBuiltDetails,A description of the details behind the year the structure was built.,Property
YearBuiltSource,YearBuiltSource,"Add a list of sources of the year built.  i.e. Appraiser, Assessor, Builder, Estimated, etc.,",Property
Zoning,Zoning,A division of the city or county into areas of different permissible land uses. This Zone field should be used for the short code that is commonly used.  For full textual descriptions please use the ZoningDescription field.,Property
FeedTypes,,,Property
BridgeModificationTimestamp,,A timestamp representing when last this record was modified in the Bridge system.,Member
ITSO_AboutMe,Member: AboutMe,About Me,Member
ITSO_AboutMeSummary,Member: AboutMeSummary,About Me Summary,Member
ITSO_CREAProfileVideo,Member: CREAProfileVideo,CREA Profile Video,Member
Media,,"An object containing media information such as id, url and type.",Member
MemberAOR,MemberAOR,The Member's Primary Board or Association of REALTORS.,Member
MemberDesignation,MemberDesignation,Designations and certifications acknowledging experience and expertise in various real estate sectors are awarded by NAR and each affiliated group upon completion of required courses.,Member
MemberDirectPhone,MemberDirectPhone,North American 10 digit phone numbers should be in the format of ###-###-#### (separated by hyphens).  Other conventions should use the common local standard.  International numbers should be preceded by a plus symbol.,Member
MemberEmail,MemberEmail,The email address of the Member.,Member
MemberFax,MemberFax,North American 10 digit phone numbers should be in the format of ###-###-#### (separated by hyphens).  Other conventions should use the common local standard.  International numbers should be preceded by a plus symbol.,Member
MemberFirstName,MemberFirstName,The first name of the Member.,Member
MemberFullName,MemberFullName,The full name of the Member. (First Middle Last) or a alternate full name.,Member
MemberHomePhone,MemberHomePhone,North American 10 digit phone numbers should be in the format of ###-###-#### (separated by hyphens).  Other conventions should use the common local standard.  International numbers should be preceded by a plus symbol.,Member
MemberKey,MemberKeyNumeric,"A unique identifier for this record from the immediate source. This is a string that can include URI or other forms.  Alternatively use the MemberKeyNumeric for a numeric only key field.  This is the local key of the system.  When records are received from other systems, a local key is commonly applied.  If conveying the original keys from the source or originating systems, see SourceSystemMemberKey and OriginatingSystemMemberKey.",Member
MemberKeyNumeric,MemberKeyNumeric,"A unique identifier for this record from the immediate source. This is the numeric only key and used as an alternative to the MemberKey fields.  This is the local key of the system.  When records are received from other systems, a local key is commonly applied.  If conveying the original keys from the source or originating systems, see SourceSystemMemberKey and OriginatingSystemMemberKey.",Member
MemberLanguages,MemberLanguages,The languages the member speaks.,Member
MemberLastName,MemberLastName,The last name of the Member.,Member
MemberMiddleName,MemberMiddleName,The middle name of the Member.,Member
MemberMlsId,MemberMlsId,"The local, well-known identifier for the member. This value may not be unique, specifically in the case of aggregation systems, this value should be the identifier from the original system.",Member
MemberMlsSecurityClass,MemberMlsSecurityClass,The MLS security group or class given to the member.,Member
MemberMobilePhone,MemberMobilePhone,North American 10 digit phone numbers should be in the format of ###-###-#### (separated by hyphens).  Other conventions should use the common local standard.  International numbers should be preceded by a plus symbol.,Member
MemberNamePrefix,MemberNamePrefix,Prefix to the name (e.g. Dr. Mr. Ms. etc.),Member
MemberNameSuffix,MemberNameSuffix,"Suffix to the surname (e.g. Esq.,  Jr.,  III etc.)",Member
MemberPager,MemberPager,North American 10 digit phone numbers should be in the format of ###-###-#### (separated by hyphens).  Other conventions should use the common local standard.  International numbers should be preceded by a plus symbol.,Member
MemberPreferredPhone,MemberPreferredPhone,North American 10 digit phone numbers should be in the format of ###-###-#### (separated by hyphens).  Other conventions should use the common local standard.  International numbers should be preceded by a plus symbol.,Member
MemberPreferredPhoneExt,MemberPreferredPhoneExt,The extension of the given phone number (if applicable).,Member
MemberType,MemberType,"The type of member.  i.e. Agent, Broker, Office Manager, Appraiser, Photographer, Assistants, MLO, Realtor, Association Staff, MLS Staff, etc.",Member
ModificationTimestamp,ModificationTimestamp,Date/time the roster (member or office) record was last modified.,Member
OfficeKeyNumeric,OfficeKeyNumeric,"A system unique identifier. Specifically, in aggregation systems, the Key is the system unique identifier from the system that the record was just retrieved. This may be identical to the related xxxId identifier, but the key is guaranteed unique for this record set. This is a foreign key relating to the Office resource's OfficeKey.  This is the numeric only key and used as an alternative to the MemberAORkey field.",Member
OfficeMlsId,OfficeMlsId,"The local, well-known identifier. This value may not be unique, specifically in the case of aggregation systems, this value should be the identifier from the original system.",Member
OriginatingSystemName,OriginatingSystemName,The name of the Originating record provider.  Most commonly the name of the MLS. The place where the member is originally input by the member.  The legal name of the company.,Member
SocialMediaFacebookUrlOrId,SocialMediaFacebookUrlOrId,"The website URL or ID of social media site or account of the member.  This is a repeating element.  Replace [Type] with any of the options from the SocialMediaType field to create a unique field for that type of social media.  For example: SocialMediaFacebookUrlOrID, SocialMediaSkypeUrlOrID, etc.",Member
SocialMediaLinkedInUrlOrId,SocialMediaLinkedInUrlOrId,"The website URL or ID of social media site or account of the member.  This is a repeating element.  Replace [Type] with any of the options from the SocialMediaType field to create a unique field for that type of social media.  For example: SocialMediaFacebookUrlOrID, SocialMediaSkypeUrlOrID, etc.",Member
SocialMediaTwitterUrlOrId,SocialMediaTwitterUrlOrId,"The website URL or ID of social media site or account of the member.  This is a repeating element.  Replace [Type] with any of the options from the SocialMediaType field to create a unique field for that type of social media.  For example: SocialMediaFacebookUrlOrID, SocialMediaSkypeUrlOrID, etc.",Member
SocialMediaWebsiteUrlOrId,SocialMediaWebsiteUrlOrId,"The website URL or ID of social media site or account of the member.  This is a repeating element.  Replace [Type] with any of the options from the SocialMediaType field to create a unique field for that type of social media.  For example: SocialMediaFacebookUrlOrID, SocialMediaSkypeUrlOrID, etc.",Member
BridgeModificationTimestamp,,A timestamp representing when last this record was modified in the Bridge system.,Office
FranchiseAffiliation,FranchiseAffiliation,The name of the franchise to which the broker/office is contracted.,Office
IDXOfficeParticipationYN,IDXOfficeParticipationYN,Does the Office/Broker participate in IDX.,Office
MainOfficeKey,MainOfficeKeyNumeric,OfficeKey of the Main Office in a firm/company of offices.  This is a self referencing foreign key relating to this resource's OfficeKey.  This key may be the same value as the OfficeKey for a given record if the given office is the Main Office.,Office
MainOfficeKeyNumeric,MainOfficeKeyNumeric,OfficeKey of the Main Office in a firm/company of offices.  This is a self referencing foreign key relating to this resource's OfficeKey.  This key may be the same value as the OfficeKey for a given record if the given office is the Main Office.  This is the numeric only key and used as an alternative to the MainOfficeKey field.,Office
MainOfficeMlsId,MainOfficeMlsId,OfficeMlsId of the Main Office in a firm/company of offices.,Office
Media,,"An object containing media information such as id, url and type.",Office
ModificationTimestamp,ModificationTimestamp,Date/time the roster (member or office) record was last modified.,Office
OfficeAOR,OfficeAOR,The Office's Board or Association of REALTORS.,Office
OfficeAddress1,OfficeAddress1,"The street number, direction, name and suffix of the office.",Office
OfficeAddress2,OfficeAddress2,The unit/suite number of the office.,Office
OfficeBrokerKey,OfficeBrokerKeyNumeric,The MemberKey of the responsible/owning broker.  This is a foreign key relating to the Member resource's MemberKey.,Office
OfficeBrokerKeyNumeric,OfficeBrokerKeyNumeric,The MemberKey of the responsible/owning broker.  This is a foreign key relating to the Member resource's MemberKey.  This is the numeric only key and used as an alternative to the OfficeBrokerKey field.,Office
OfficeBrokerMlsId,OfficeBrokerMlsId,The MemberMlsId of the responsible/owning broker.,Office
OfficeCity,OfficeCity,The city of the office.,Office
OfficeCorporateLicense,OfficeCorporateLicense,"When an office/firm is a corporation, an independent license number is issued.",Office
OfficeCountyOrParish,OfficeCountyOrParish,The county or parish in which the offices is located.,Office
OfficeEmail,OfficeEmail,The email address of the office,Office
OfficeFax,OfficeFax,North American 10 digit phone numbers should be in the format of ###-###-#### (separated by hyphens).  Other conventions should use the common local standard.  International numbers should be preceded by a plus symbol.,Office
OfficeKey,OfficeKeyNumeric,"A system unique identifier. Specifically, in aggregation systems, the Key is the system unique identifier from the system that the record was just retrieved. This may be identical to the related xxxId identifier, but the key is guaranteed unique for this record set.",Office
OfficeKeyNumeric,OfficeKeyNumeric,"A unique identifier for this record from the immediate source. This is the numeric only key and used as an alternative to the OfficeKey fields.  This is the local key of the system.  When records are received from other systems, a local key is commonly applied.  If conveying the original keys from the source or originating systems, see SourceSystemOfficeKey and OriginatingSystemOfficeKey.",Office
OfficeManagerKey,OfficeManagerKeyNumeric,The lead Office Manager for the given office.  This is a foreign key relating to the Member resource's MemberKey.,Office
OfficeManagerKeyNumeric,OfficeManagerKeyNumeric,The lead Office Manager for the given office.  This is a foreign key relating to the Member resource's MemberKey.  This is the numeric only key and used as an alternative to the OfficeManagerKey field.,Office
OfficeManagerMlsId,OfficeManagerMlsId,The lead Office Manager for the given office.,Office
OfficeMlsId,OfficeMlsId,"The local, well-known identifier. This value may not be unique, specifically in the case of aggregation systems, this value should be the identifier from the original system.",Office
OfficeName,OfficeName,The legal name of the brokerage.,Office
OfficeNationalAssociationId,OfficeNationalAssociationId,The national association ID of the office.  i.e. in the U.S. is the NRDS number.,Office
OfficePhone,OfficePhone,North American 10 digit phone numbers should be in the format of ###-###-#### (separated by hyphens).  Other conventions should use the common local standard.  International numbers should be preceded by a plus symbol.,Office
OfficePhoneExt,OfficePhoneExt,The extension of the given phone number (if applicable).,Office
OfficePostalCode,OfficePostalCode,The postal code of the office.,Office
OfficePostalCodePlus4,OfficePostalCodePlus4,The extension of the postal/zip code.  i.e. +4,Office
OfficeStateOrProvince,OfficeStateOrProvince,The state or province in which the office is located.,Office
OfficeStatus,OfficeStatus,"Is the office active, inactive or under disciplinary action.",Office
OfficeType,OfficeType,"The type of business conducted by the office.  i.e. Real Estate, Appraiser, etc.",Office
OriginalEntryTimestamp,OriginalEntryTimestamp,Date/time the roster (member or office) record was originally input into the source system.,Office
OriginatingSystemID,,"The RESO OUID's OrganizationUniqueId of the Originating record provider.  The Originating system is the system with authoritative control over the record.  For example; the name of the MLS where the office was input.  In cases where the Originating system was not where the record originated (the authoritative system), see the Originating System fields.",Office
OriginatingSystemName,OriginatingSystemName,The name of the Originating record provider.  Most commonly the name of the MLS. The place where the office is originally input by the member.  The legal name of the company.,Office
OriginatingSystemOfficeKey,OriginatingSystemOfficeKey,"The system key, a unique record identifier, from the Originating system.  The Originating system is the system with authoritative control over the record.  For example, the Multiple Listing Service where the office was input.  There may be cases where the Source System (how you received the record) is not the Originating System.  See Source System Key for more information.",Office
SocialMediaFacebookUrlOrId,SocialMediaFacebookUrlOrId,"The website URL or ID of social media site or account of the member.  This is a repeating element.  Replace [Type] with any of the options from the SocialMediaType field to create a unique field for that type of social media.  For example: SocialMediaFacebookUrlOrID, SocialMediaSkypeUrlOrID, etc.",Office
SocialMediaLinkedInUrlOrId,SocialMediaLinkedInUrlOrId,"The website URL or ID of social media site or account of the member.  This is a repeating element.  Replace [Type] with any of the options from the SocialMediaType field to create a unique field for that type of social media.  For example: SocialMediaFacebookUrlOrID, SocialMediaSkypeUrlOrID, etc.",Office
SocialMediaTwitterUrlOrId,SocialMediaTwitterUrlOrId,"The website URL or ID of social media site or account of the member.  This is a repeating element.  Replace [Type] with any of the options from the SocialMediaType field to create a unique field for that type of social media.  For example: SocialMediaFacebookUrlOrID, SocialMediaSkypeUrlOrID, etc.",Office
SocialMediaWebsiteUrlOrId,SocialMediaWebsiteUrlOrId,"The website URL or ID of social media site or account of the member.  This is a repeating element.  Replace [Type] with any of the options from the SocialMediaType field to create a unique field for that type of social media.  For example: SocialMediaFacebookUrlOrID, SocialMediaSkypeUrlOrID, etc.",Office
SyndicateAgentOption,SyndicateAgentOption,"A list of options allowing the broker to pass the decision of syndication choice down to the listing agents.  i.e. No Agent Choice, Allow Agent Choice, Restrict Agent Choice, etc.",Office
SyndicateTo,SyndicateTo,"The principal broker's choice on where they would like their listings syndicated.  i.e. Zillow, Trulia, Homes.com, etc.",Office
BridgeModificationTimestamp,,A timestamp representing when last this record was modified in the Bridge system.,Openhouse
ITSO_EndTime,OpenHouse: EndTime,End Time,Openhouse
ITSO_EntryOrder,OpenHouse: EntryOrder,Entry Order,Openhouse
ITSO_GeocodeSource,OpenHouse: GeocodeSource,Geocode Source,Openhouse
ITSO_IsDeleted,OpenHouse: IsDeleted,Is Deleted,Openhouse
ITSO_Latitude,OpenHouse: Latitude,Latitude,Openhouse
ITSO_Longitude,OpenHouse: Longitude,Longitude,Openhouse
ITSO_OriginatingSystemListingKey,OpenHouse: OriginatingSystemListingKey,Originating System Listing Key,Openhouse
ITSO_StartTime,OpenHouse: StartTime,Start Time,Openhouse
