DD Field,Source Field,Field Description,Resource
AboveGradeFinishedArea,AboveGradeFinishedArea,Finished area within the structure that is at or above the surface of the ground.,Property
AboveGradeFinishedAreaSource,AboveGradeFinishedAreaSource,"The source of the measurements. This is a pick list of options showing the source of the measurement. i.e. Agent, Assessor, Estimate, etc.",Property
AboveGradeFinishedAreaUnits,AboveGradeFinishedAreaUnits,"A pick list of the unit of measurement for the area.  i.e. Square Feet, Square Meters, Acres, etc.",Property
AccessibilityFeatures,AccessibilityFeatures,A list or description of the accessibility features included in the sale/lease.,Property
AdditionalParcelsYN,NumberOfParcels,Are there more than one parcel or lot included in the sale?,Property
Appliances,"Appliances, Inclusions, InteriorFeatures, NumberOfDishwashers, NumberOfDryers, NumberOfRefrigerators, NumberOfStoves, NumberOfWashers",A list of the appliances that will be included in the sale/lease of the property.,Property
ArchitecturalStyle,ArchitecturalStyle,"A list describing the style of the structure.  For example, Victorian, Ranch, Craftsman, etc.",Property
AssociationAmenities,AssociationAmenities,"Amenities provided by the Home Owners Association, Mobile Park or Complex. For example Pool, Clubhouse, etc.",Property
AssociationFee,AssociationFee,"A fee paid by the homeowner to the Home Owners Association which is used for the upkeep of the common area, neighborhood or other association related benefits.",Property
AssociationFee2,AdditionalMonthlyFees,"A fee paid by the homeowner to the second of two Home Owners Associations, which is used for the upkeep of the common area, neighborhood or other association related benefits.",Property
AssociationFee2Frequency,"""Monthly"',"The frequency the association fee is paid.  For example, Weekly, Monthly, Annually, Bi-Monthly, One Time, etc.",Property
AssociationFeeFrequency,AssociationFeeFrequency,"The frequency the association fee is paid.  For example, Weekly, Monthly, Annually, Bi-Monthly, One Time, etc.",Property
AssociationFeeIncludes,"AssociationFeeIncludes, AssociationFeeIncludesText","Services included with the association fee.  For example Landscaping, Trash, Water, etc.",Property
AssociationYN,"AssociationAmenities, AssociationFee, AssociationFeeFrequency, AssociationFeeIncludes",Is there a Home Owners Association.  A separate Y/N field is needed because not all associations have dues.,Property
AttachedGarageYN,"GarageType, ParkingFeatures",A flag indicating that the garage attached to the dwelling.,Property
Basement,"Basement, BasementFinish, BasementType, InteriorFeatures","A list of information and features about the basement.  i.e. None/Slab, Finished, Partially Finished, Crawl Space, Dirt, Outside Entrance, Radon Mitigation",Property
BathroomsFull,BathroomsFull,"A room containing all 4 of the 4 elements constituting a bath, which are; Toilet, Sink, Bathtub or Shower Head.  A Full Bath will typically contain four elements; Sink, Toilet, Tub and Shower Head (in tub or stall).  However, some may considered a Sink, Toilet and Tub (without a shower) a Full Bath, others consider this to be a Three Quarter Bath.  In the event that BathroomsThreeQuarter is not in use, this field may represent the sum of all Full and Three Quarter bathrooms.",Property
BathroomsHalf,BathroomsHalf,"A room containing 2 of the 4 elements constituting a bath, which are; Toilet, Sink, Bathtub or Shower Head.  A Half Bath will typically contain a Sink and Toilet.",Property
BathroomsTotalDecimal,,A decimal representation of the total number of bathrooms.,Property
BathroomsTotalInteger,BathroomsTotalInteger,"The simple sum of the number of bathrooms.  For example for a property with two Full Bathrooms and one Half Bathroom, the Bathrooms Total Integer will be 3.  To express this example as 2.5, use the BathroomsTotalDecimal field.  To express this example as 2.1, use the BathroomsTotalNotational.",Property
BedroomsTotal,"BedroomsTotal, NumberOf1BedroomUnits, NumberOf2BedroomUnits, NumberOf3BedroomUnits, NumberOf4BedroomUnits, NumberOf5BedroomUnits, NumberOf6PlusBedroomUnits",The total number of bedrooms in the dwelling.,Property
BelowGradeFinishedArea,BelowGradeFinishedArea,Finished area within the structure that is below ground.,Property
BelowGradeFinishedAreaSource,BelowGradeFinishedAreaSource,"The source of the measurements. This is a pick list of options showing the source of the measurement. i.e. Agent, Assessor, Estimate, etc.",Property
BelowGradeFinishedAreaUnits,BelowGradeFinishedAreaUnits,"A pick list of the unit of measurement for the area.  i.e. Square Feet, Square Meters, Acres, etc.",Property
BridgeModificationTimestamp,,A timestamp representing when last this record was modified in the Bridge system.,Property
BuildingAreaSource,BuildingAreaSource,"The source of the measurements. This is a pick list of options showing the source of the measurement. i.e. Agent, Assessor, Estimate, etc.",Property
BuildingAreaTotal,BuildingAreaTotal,Total area of the structure. Includes both finished and unfinished areas.,Property
BuildingAreaUnits,BuildingAreaUnits,"A pick list of the unit of measurement for the area.  i.e. Square Feet, Square Meters, Acres, etc.",Property
BuildingName,BuildingName,Name of the building or business park.,Property
BusinessName,BusinessName,Name of the business being sold.,Property
BusinessType,BusinessType,"The type of business being sold. Retail, Wholesale, Grocery, Food & Bev, etc.",Property
CarportSpaces,CarportSpaces,The number of carport spaces included in the sale.,Property
CarportYN,"CarportSpaces, ParkingFeatures","A flag indicating that the listing has a car port. This flag may be T/F, Y/N or other true, false or unknown indicator. As with all flags, the field may be null.",Property
City,City,The city in listing address.,Property
CoListAgentAOR,CoListAgentAOR,The Co Listing Agent's Board or Association of REALTORS.,Property
CoListAgentCellPhone,CoListAgentMobilePhone,North American 10 digit phone numbers should be in the format of ###-###-#### (separated by hyphens).  Other conventions should use the common local standard.  International numbers should be preceded by a plus symbol.,Property
CoListAgentDesignation,CoListAgentDesignation,Designations and certifications acknowledging experience and expertise in various real estate sectors are awarded by NAR and each affiliated group upon completion of required courses.,Property
CoListAgentDirectPhone,CoListAgentDirectPhone,North American 10 digit phone numbers should be in the format of ###-###-#### (separated by hyphens).  Other conventions should use the common local standard.  International numbers should be preceded by a plus symbol.,Property
CoListAgentEmail,CoListAgentEmail,The email address of the Co Listing Agent.,Property
CoListAgentFullName,CoListAgentFullName,The full name of the co-listing agent. (First Middle Last),Property
CoListAgentKeyNumeric,CoListAgentKeyNumeric,"A system unique identifier. Specifically, in aggregation systems, the Key is the system unique identifier from the system that the record was just retrieved. This may be identical to the related xxxId identifier, but the key is guaranteed unique for this record set.  This is a foreign key relating to the Member resource's MemberKey.  This is the numeric only key and used as an alternative to the CoListAgentKey field.",Property
CoListAgentMlsId,CoListAgentMlsId,"The local, well-known identifier. This value may not be unique, specifically in the case of aggregation systems, this value should be the identifier from the original system.",Property
CoListAgentPreferredPhone,"CoListAgentDirectPhone, CoListAgentMobilePhone",North American 10 digit phone numbers should be in the format of ###-###-#### (separated by hyphens).  Other conventions should use the common local standard.  International numbers should be preceded by a plus symbol.,Property
CoListOfficeFax,CoListOfficeFax,North American 10 digit phone numbers should be in the format of ###-###-#### (separated by hyphens).  Other conventions should use the common local standard.  International numbers should be preceded by a plus symbol.,Property
CoListOfficeKeyNumeric,CoListOfficeKeyNumeric,"A system unique identifier. Specifically, in aggregation systems, the Key is the system unique identifier from the system that the record was just retrieved. This may be identical to the related xxxId identifier, but the key is guaranteed unique for this record set.  This is a foreign key relating to the Office resource's OfficeKey.  This is the numeric only key and used as an alternative to the CoListOfficeKey field.",Property
CoListOfficeMlsId,CoListOfficeMlsId,"The local, well-known identifier. This value may not be unique, specifically in the case of aggregation systems, this value should be the identifier from the original system.",Property
CoListOfficeName,CoListOfficeName,The legal name of the brokerage co-representing the seller.,Property
CoListOfficePhone,CoListOfficePhone,North American 10 digit phone numbers should be in the format of ###-###-#### (separated by hyphens).  Other conventions should use the common local standard.  International numbers should be preceded by a plus symbol.,Property
CoListOfficePhoneExt,CoListOfficePhoneExt,The extension of the given phone number (if applicable).,Property
ConstructionMaterials,ConstructionMaterials,A list of the materials that were used in the construction of the property.,Property
Cooling,Cooling,A list describing the cooling or air conditioning features of the property.,Property
CoolingYN,CoolingYN,The property has cooling or Air Conditioning.,Property
Coordinates,,"Geographical coordinates (longitude, latitude)",Property
Country,"""CA"',The country abbreviation in a postal address.,Property
CountyOrParish,CountyOrParish,"The County, Parish or other regional authority",Property
CoveredSpaces,"CarportSpaces, GarageSpaces",The total number of garage and carport spaces.,Property
CropsIncludedYN,CropsIncludedYN,Are crops included in the sale of the property.,Property
CrossStreet,CrossStreet,"Nearest cross streets to the property.  This field is in addition to, and independent of, the driving directions field.",Property
CultivatedArea,AcresWorkable,Measurement or percentage of the property that has been cultivated.,Property
DirectionFaces,DirectionFaces,"The compass direction that the main entrance to the building faces. For example, North, South, East, West, South-West, etc. It may also be known as the building exposure.",Property
Directions,Directions,Driving directions to the property.,Property
DoorFeatures,ExteriorFeatures,A list of features or description of the doors included in the sale/lease.,Property
Electric,"Amps, Electric, Volts","A list of electric-service related features of the property (e.g. 110 Volt, 3 Phase, 220 Volt, RV Hookup). Note: the previous 'Electric' field was renamed to DistanceToElectricComments",Property
ElectricExpense,ElectricExpense,The annual expense that is not paid directly by the tenant and is included in the Operating Expense calculations.,Property
ElectricOnPropertyYN,Services,Does the property currently have electrical utility available on the property.,Property
ElementarySchool,ElementarySchool,The name of the primary school having a catchment area that includes the associated property.,Property
Exclusions,Exclusions,Elements of the property that will not be included in the sale.  i.e. Chandeliers will be removed prior to close.,Property
ExistingLeaseType,PriceType,"Information about the status of the existing lease on the property.  i.e. Net, NNN, NN, Gross, Absolute Net, Escalation Clause, Ground Lease, etc.",Property
ExteriorFeatures,"ExteriorFeatures, OutsideStorageYN",A list of features or description of the exterior of the property included in the sale/lease.,Property
FarmLandAreaUnits,"""Square Feet"',"A pick list of the unit of measurement for the area.  i.e. Square Feet, Square Meters, Acres, etc.  This field applies to all farm area fields (Cultivated, Pasture, Range, Wooded)",Property
Fencing,"ExteriorFeatures, FarmFeatures, OtherStructures",A list of types of fencing found at the property being sold.,Property
FireplaceFeatures,FireplaceFeatures,A list of features or description of the fireplace(s) included in the sale/lease.,Property
FireplaceYN,"FireplaceFeatures, Heating, NumberOfFireplaces",Does the property include a fireplace.,Property
FireplacesTotal,NumberOfFireplaces,The total number of fireplaces included in the property.,Property
Flooring,Flooring,A list of the type(s) of flooring found within the property.,Property
FoundationDetails,FoundationDetail,A list of the type(s) of foundation on which the property sits.,Property
FrontageLength,LotFront,Textual description of the length of the frontages selected in the Frontage Type field.,Property
FrontageType,FrontingOn,"Pick list of types of frontage. i.e. Oceanfront, Lakefront, Golf course, etc. Information about roads or road frontage should be located in the Road Frontage Type and Road Surface Type fields.",Property
Furnished,Furnished,"The property being leased is furnished, unfurnished or partially furnished.",Property
GarageSpaces,GarageSpaces,The number of spaces in the garage(s).,Property
GarageYN,GarageYN,"A flag indicating that the listing has a garage. This flag may be T/F, Y/N or other true, false or unknown indicator. As with all flags, the field may be null.",Property
GreenEnergyEfficient,GreenEnergyEfficient,"Pick list of general green attributes such as energy efficient doors, or appliances without naming specific elements with ratings that may wane over time.",Property
GreenEnergyGeneration,GreenEnergyGeneration,Methods of generating power that are included in the sale or lease.,Property
GreenIndoorAirQuality,GreenIndoorAirQuality,Pick list of indoor air quality measures without naming specific elements with ratings that may wane over time.,Property
GreenSustainability,GreenSustainability,Pick list of sustainable elements used in the construction of the structure without naming specific elements with ratings that may wane over time.,Property
GreenWaterConservation,GreenWaterConservation,Pick list of general water conserving attributes of the property such as landscaping or reclamation without naming specific elements with ratings that may wane over time.,Property
HabitableResidenceYN,"Bunkhouse, OtherStructures, OtherStructuresFarm, PropertyType",Does the property include a structure that can be lived in.,Property
Heating,"Heating, HeatingSecondary",A list describing the heating features of the property.,Property
HeatingYN,Heating,The property has heating.,Property
HighSchool,HighSchool,The name of the high school having a catchment area that includes the associated property.,Property
HorseAmenities,FarmFeatures,A list of horse amenities on the lot or in the community.,Property
HorseYN,FarmType,The Property is allowed to raise horses.,Property
HoursDaysOfOperation,DaysOfOperation,A simplified enumerated list of the days and hours of operation of the business being sold.  i.e. Open 24 Hours or Open 7 Days.  For more detailed descriptions use the HoursDaysofOperationDescription field.,Property
ITSO_AboveGradeFinishedAreaSrchSqFt,Property: AboveGradeFinishedAreaSrchSqFt,Above Grade Finished Area Srch S,Property
ITSO_AcresBush,Property: AcresBush,Acres Bush,Property
ITSO_AcresClear,Property: AcresClear,Acres Clear,Property
ITSO_AcresFenced,Property: AcresFenced,Acres Fenced,Property
ITSO_AcresRange,Property: AcresRange,Acres Range,Property
ITSO_AcresTiledRandom,Property: AcresTiledRandom,Acres Tiled Random,Property
ITSO_AcresTiledSystem,Property: AcresTiledSystem,Acres Tiled System,Property
ITSO_AcresWaste,Property: AcresWaste,Acres Waste,Property
ITSO_ActiveOpenHouseCount,Property: ActiveOpenHouseCount,Active Open House Count,Property
ITSO_AdditionalImagesURL,Property: AdditionalImagesURL,Additional Images URL,Property
ITSO_AdditionalRent,Property: AdditionalRent,Additional Rent,Property
ITSO_AdditionalResidence,Property: AdditionalResidence,Additional Residence,Property
ITSO_AdministrativeFee,Property: AdministrativeFee,Administrative Fee,Property
ITSO_AgeElectric,Property: AgeElectric,Age Electric,Property
ITSO_AgeFurnace,Property: AgeFurnace,Age Furnace,Property
ITSO_AgePlumbing,Property: AgePlumbing,Age Plumbing,Property
ITSO_AgeTank,Property: AgeTank,Age Tank,Property
ITSO_AlternateFeatureSheetURL,Property: AlternateFeatureSheetURL,Alternate Feature Sheet URL,Property
ITSO_AlternateMLSNumber,Property: AlternateMLSNumber,Alternate MLS Number,Property
ITSO_AssessmentRollNumber,Property: AssessmentRollNumber,Assessment Roll Number,Property
ITSO_AssessmentYear,Property: AssessmentYear,Assessment Year,Property
ITSO_AssignmentOfListingYN,Property: AssignmentOfListingYN,Assignment Of Listing YN,Property
ITSO_AssociationFeeRemarks,Property: AssociationFeeRemarks,Association Fee Remarks,Property
ITSO_Banner,Property: Banner,Banner,Property
ITSO_BathsOnLevelBasementCount,Property: BathsOnLevelBasementCount,Baths On Level Basement Count,Property
ITSO_BathsOnLevelGroundCount,Property: BathsOnLevelGroundCount,Baths On Level Ground Count,Property
ITSO_BathsOnLevelLowerCount,Property: BathsOnLevelLowerCount,Baths On Level Lower Count,Property
ITSO_BathsOnLevelSecondCount,Property: BathsOnLevelSecondCount,Baths On Level Second Count,Property
ITSO_BathsOnLevelThirdCount,Property: BathsOnLevelThirdCount,Baths On Level Third Count,Property
ITSO_BathsOnLevelUpperCount,Property: BathsOnLevelUpperCount,Baths On Level Upper Count,Property
ITSO_BathsTotalRooms,Property: BathsTotalRooms,Baths Total Rooms,Property
ITSO_BaySizeLength,Property: BaySizeLength,Bay Size Length,Property
ITSO_BaySizeWidth,Property: BaySizeWidth,Bay Size Width,Property
ITSO_BedsAboveGrade,Property: BedsAboveGrade,Beds Above Grade,Property
ITSO_BedsBelowGrade,Property: BedsBelowGrade,Beds Below Grade,Property
ITSO_BedsOnLevelBasementCount,Property: BedsOnLevelBasementCount,Beds On Level Basement Count,Property
ITSO_BedsOnLevelGroundCount,Property: BedsOnLevelGroundCount,Beds On Level Ground Count,Property
ITSO_BedsOnLevelSecondCount,Property: BedsOnLevelSecondCount,Beds On Level Second Count,Property
ITSO_BedsOnLevelThirdCount,Property: BedsOnLevelThirdCount,Beds On Level Third Count,Property
ITSO_BelowGradeFinishedAreaSrchSqFt,Property: BelowGradeFinishedAreaSrchSqFt,Below Grade Finished Area Srch S,Property
ITSO_BillingYN,Property: BillingYN,Billing YN,Property
ITSO_BuildingAreaTotalSrchSqFt,Property: BuildingAreaTotalSrchSqFt,Building Area Total Srch Sq Ft,Property
ITSO_BuildingPercentage,Property: BuildingPercentage,Building Percentage,Property
ITSO_BuildingSizeMax,Property: BuildingSizeMax,Building Size Max,Property
ITSO_BuildingSizeMin,Property: BuildingSizeMin,Building Size Min,Property
ITSO_BuyOptionYN,Property: BuyOptionYN,Buy Option YN,Property
ITSO_BuyerAgentDesignation,Property: BuyerAgentDesignation,Buyer Agent Designation,Property
ITSO_CeilingHeight,Property: CeilingHeight,Ceiling Height,Property
ITSO_CertificationLevel,Property: CertificationLevel,Certification Level,Property
ITSO_ChannelName,Property: ChannelName,Channel Name,Property
ITSO_ClearanceHeight,Property: ClearanceHeight,Clearance Height,Property
ITSO_CoBuyerAgent2Designation,Property: CoBuyerAgent2Designation,Co Buyer Agent 2 Designation,Property
ITSO_CoBuyerAgent3Designation,Property: CoBuyerAgent3Designation,Co Buyer Agent 3 Designation,Property
ITSO_CoBuyerAgentDesignation,Property: CoBuyerAgentDesignation,Co Buyer Agent Designation,Property
ITSO_CoListAgent2AOR,Property: CoListAgent2AOR,Co List Agent 2 AOR,Property
ITSO_CoListAgent2Designation,Property: CoListAgent2Designation,Co List Agent 2 Designation,Property
ITSO_CoListAgent2DirectPhone,Property: CoListAgent2DirectPhone,Co List Agent 2 Direct Phone,Property
ITSO_CoListAgent2Email,Property: CoListAgent2Email,Co List Agent 2 Email,Property
ITSO_CoListAgent2FullName,Property: CoListAgent2FullName,Co List Agent 2 Full Name,Property
ITSO_CoListAgent2KeyNumeric,Property: CoListAgent2KeyNumeric,Co List Agent 2 Key Numeric,Property
ITSO_CoListAgent2MlsId,Property: CoListAgent2MlsId,Co List Agent 2 Mls Id,Property
ITSO_CoListAgent3AOR,Property: CoListAgent3AOR,Co List Agent 3 AOR,Property
ITSO_CoListAgent3Designation,Property: CoListAgent3Designation,Co List Agent 3 Designation,Property
ITSO_CoListAgent3DirectPhone,Property: CoListAgent3DirectPhone,Co List Agent 3 Direct Phone,Property
ITSO_CoListAgent3Email,Property: CoListAgent3Email,Co List Agent 3 Email,Property
ITSO_CoListAgent3FullName,Property: CoListAgent3FullName,Co List Agent 3 Full Name,Property
ITSO_CoListAgent3KeyNumeric,Property: CoListAgent3KeyNumeric,Co List Agent 3 Key Numeric,Property
ITSO_CoListAgent3MlsId,Property: CoListAgent3MlsId,Co List Agent 3 Mls Id,Property
ITSO_CoListOffice2Fax,Property: CoListOffice2Fax,Co List Office 2 Fax,Property
ITSO_CoListOffice2KeyNumeric,Property: CoListOffice2KeyNumeric,Co List Office 2 Key Numeric,Property
ITSO_CoListOffice2MlsId,Property: CoListOffice2MlsId,Co List Office 2 Mls Id,Property
ITSO_CoListOffice2Name,Property: CoListOffice2Name,Co List Office 2 Name,Property
ITSO_CoListOffice2Phone,Property: CoListOffice2Phone,Co List Office 2 Phone,Property
ITSO_CoListOffice3Fax,Property: CoListOffice3Fax,Co List Office 3 Fax,Property
ITSO_CoListOffice3KeyNumeric,Property: CoListOffice3KeyNumeric,Co List Office 3 Key Numeric,Property
ITSO_CoListOffice3MlsId,Property: CoListOffice3MlsId,Co List Office 3 Mls Id,Property
ITSO_CoListOffice3Name,Property: CoListOffice3Name,Co List Office 3 Name,Property
ITSO_CoListOffice3Phone,Property: CoListOffice3Phone,Co List Office 3 Phone,Property
ITSO_CommercialDoorsCount,Property: CommercialDoorsCount,Commercial Doors Count,Property
ITSO_CommonAreaUpcharge,Property: CommonAreaUpcharge,Common Area Upcharge,Property
ITSO_CommonElementsFeeYN,Property: CommonElementsFeeYN,Common Elements Fee YN,Property
ITSO_CommonInterest,CommonInterest,Common Interest,Property
ITSO_ConditionalSaleIndicatorCode,Property: ConditionalSaleIndicatorCode,Conditional Sale Indicator Code,Property
ITSO_CondoCorporationNumber,Property: CondoCorporationNumber,Condo Corporation Number,Property
ITSO_CondoCorporationYN,Property: CondoCorporationYN,Condo Corporation YN,Property
ITSO_CondoCorporationYearEnd,Property: CondoCorporationYearEnd,Condo Corporation Year End,Property
ITSO_ConstructionAuditYN,Property: ConstructionAuditYN,Construction Audit YN,Property
ITSO_ContractsInPlace,Property: ContractsInPlace,Contracts In Place,Property
ITSO_CraneYN,Property: CraneYN,Crane YN,Property
ITSO_CurrentPrice,Property: CurrentPrice,Current Price,Property
ITSO_DevelopmentChargesPaid,Property: DevelopmentChargesPaid,Development Charges Paid,Property
ITSO_DivisibleYN,Property: DivisibleYN,Divisible YN,Property
ITSO_DockingFeatures,Property: DockingFeatures,Docking Features,Property
ITSO_DockingType,Property: DockingType,Docking Type,Property
ITSO_DockingYN,Property: DockingYN,Docking YN,Property
ITSO_DrivewayParking,Property: DrivewayParking,Driveway Parking,Property
ITSO_EnergyCertificationDate,Property: EnergyCertificationDate,Energy Certification Date,Property
ITSO_EnergyCertificationLevel,Property: EnergyCertificationLevel,Energy Certification Level,Property
ITSO_EnergyCertificationYN,Property: EnergyCertificationYN,Energy Certification YN,Property
ITSO_EnvironmentalAuditYN,Property: EnvironmentalAuditYN,Environmental Audit YN,Property
ITSO_EnvironmentalPhase,Property: EnvironmentalPhase,Environmental Phase,Property
ITSO_EstimatedInventoryValuesAtCost,Property: EstimatedInventoryValuesAtCost,Estimated Inventory Values At Co,Property
ITSO_ExcludeFromInventoryStats,Property: ExcludeFromInventoryStats,Exclude From Inventory Stats,Property
ITSO_Expenses,Property: Expenses,Expenses,Property
ITSO_FarmRemarks,Property: FarmRemarks,Farm Remarks,Property
ITSO_FireplaceStoveOperationalYN,Property: FireplaceStoveOperationalYN,Fireplace Stove Operational YN,Property
ITSO_FranchiseAgreementRequiredYN,Property: FranchiseAgreementRequiredYN,Franchise Agreement Required YN,Property
ITSO_FranchiseApprovalRequiredYN,Property: FranchiseApprovalRequiredYN,Franchise Approval Required YN,Property
ITSO_FranchiseFeeIncludedYN,Property: FranchiseFeeIncludedYN,Franchise Fee Included YN,Property
ITSO_FranchiseYN,Property: FranchiseYN,Franchise YN,Property
ITSO_FranchiseYearsOperated,Property: FranchiseYearsOperated,Franchise Years Operated,Property
ITSO_FreestandingYN,Property: FreestandingYN,Freestanding YN,Property
ITSO_GarageSpacesDescription,Property: GarageSpacesDescription,Garage Spaces Description,Property
ITSO_GradeLevelDoorHeight,Property: GradeLevelDoorHeight,Grade Level Door Height,Property
ITSO_GradeLevelDoorWidth,Property: GradeLevelDoorWidth,Grade Level Door Width,Property
ITSO_GradeLevelShippingDoors,Property: GradeLevelShippingDoors,Grade Level Shipping Doors,Property
ITSO_GreenPropertyInformationStatementYN,Property: GreenPropertyInformationStatementYN,Green Property Information State,Property
ITSO_GreenVerificationCount,Property: GreenVerificationCount,Green Verification Count,Property
ITSO_HSTApplicableToSalePrice,Property: HSTApplicableToSalePrice,HST Applicable To Sale Price,Property
ITSO_HSTApplicableonCommission,Property: HSTApplicableonCommission,HST Applicableon Commission,Property
ITSO_HeatingExpenses,Property: HeatingExpenses,Heating Expenses,Property
ITSO_HoldoverDays,Property: HoldoverDays,Holdover Days,Property
ITSO_IncomePotentialYN,Property: IncomePotentialYN,Income Potential YN,Property
ITSO_IndustrialArea,Property: IndustrialArea,Industrial Area,Property
